ID,Target,review_content,review_title,review_stars,product,tokenized_content,tokenized_title,difficultword_content,linsear_title,len,english,listpos,listneg
1,0,Ca serait plutot un film tres bien si ils ont pas engager Richard Dreyfus. La jeune Liv Taylor et plausible et John Lithgow est superbe mais le pompeux Richard Dreyfus ruine beaucoup. Dommage,les bons acteurs avec un citron,4,e51597abac17b408ffc23010522f89c2e6c4ac0c8ac9cf7c6a45adff5e5499fc86aea1b0086ecb01833830f2c97a8d7f6d2ff74254ab7b19cf3b390c56e732fa,1,1,14,2,191,It would rather be a movie very well if they did not engage Richard Dreyfus. The young and plausible Liv Taylor and John Lithgow are superb but the pompous Richard Dreyfus ruins a lot. Pity,1.5,1.625
2,0,"Un univers unique, une mélodie immortelle, une oeuvre culte!!! PHANTASM, c'est l'histoire de MIKE qui tente d'échapper au mythique ""TALL MAN""; joué par le (très)grand ANGUS SCRIMM; un croque-mort qui aspire les âmes des morts pour les assouvir et qui se débarrasse des vivants grâce à ses sphères volantes qui transpercent les cerveaux... L'imagination débordante de DON COSCARELLI part dans tous les sens : rare sont ceux qui ont tout compris car ce film comporte de nombreux défauts mais c'est ce qu'il lui donne tout son charme...(l¿édition MGM comporte des sous titre français)",Un univers unique !!,5,6187ea4f95c43a913061506bd165f13a24772a2fd758ec60eccecde060ec1348095dbfb79fea6bbc61447c8bcf075c792d89ebc24bd1d0b0df38525c90847f79,1,1,21,0,581,"A unique universe, an immortal melody, a cult piece !!! PHANTASM is the story of MIKE trying to escape the mythical ""TALL MAN""; played by the (very) big ANGUS SCRIMM; an undertaker who sucks the souls of the dead to satiate them and who gets rid of the living thanks to his flying spheres that pierce the brains ... The overflowing imagination of DON COSCARELLI goes in all directions: rare are those who have everything understood because this film has many flaws but it gives it all its charm ... (the MGM edition includes French subtitles)",1.25,1.75
3,0,"Je pense que compte-tenu de la rareté de ce film, le prix ici est dérisoire. Personnellement, je l'aurais vendu 1430 euros. Ben oui, quoi tant qu'à faire, non?
Cela exprimé, ""Operation Shakespeare"" (Renaissance Man) est un très bon film que j'aurai bien voulu offrir à mon fils. Mais...",C'est donné...,5,5494110a6f34bff078cd5facc4ee1852633135d8741ecff4414e334301032795828d2f6034c66819e96f5f910dc45d31d0a876adef6976c3c536b7ef625dc39a,1,1,11,1,286,"I think that given the rarity of this film, the price here is ridiculous. Personally, I would have sold 1430 euros. Yeah, what so much to do, right?
That expressed, ""Operation Shakespeare"" (Renaissance Man) is a very good film that I would have liked to offer to my son. But...",1.125,1.0
4,0,"un film super top, une excellente surprise, drôle inspiré, varié , cette comédie fait aussi l'apologie de la connaissance et le fait de manière ludique, que demander de mieux, c'est grave sympa mon colonel",garde a vous,5,5494110a6f34bff078cd5facc4ee1852633135d8741ecff4414e334301032795828d2f6034c66819e96f5f910dc45d31d0a876adef6976c3c536b7ef625dc39a,1,1,10,0,205,"a movie super top, a great surprise, funny inspired, varied, this comedy is also the apology of knowledge and the fact that fun, what to ask for better, it's serious nice my colonel",3.375,0.625
5,1,"USA, années 80/90. Un publicitaire Américain au chômage enseigne Shakespeare à de jeunes soldats. // Aucune lourdeur Américaine, aucun comique troupier. Presque une comédie Anglaise, made in America.",Comédie Américaine et militaire mais excellente,5,5494110a6f34bff078cd5facc4ee1852633135d8741ecff4414e334301032795828d2f6034c66819e96f5f910dc45d31d0a876adef6976c3c536b7ef625dc39a,1,1,14,3,199,"USA, 80s / 90s. An unemployed American publicist is teaching Shakespeare to young soldiers. // No American heaviness, no comic trooper. Almost an English comedy, made in America.",0.5,0.625
